{
  "avatar": {
    "gravatar": {
      "hash": "c9e9fc152ee756a900db85757c29815d"
    },
    "tmdb": {
      "avatar_path": "/xy44UvpbTgzs9kWmp4C3fEaCl5h.png"
    }
  },
  "id": 548,
  "iso_639_1": "en",
  "iso_3166_1": "CA",
  "name": "Travis Bell",
  "include_adult": false,
  "username": "travisbell"
}